	mutations	Q228	F229	K230	Q231	Y233	E234	D236	G237	P239	K242	E243	D246	Q253	K254	R255	G256	T257	P258	N260	R261	A266	K267	M274	V277	E287	N290	K292	R295	E296	K299	G300	N302	P304	T305	S306	I307	T308	F312	M319	C327	E328	K329	R330	G331	L332	N334	P335	N336	E337	Q339	A340	D343	S344	R346	n_mutations	avg_dG
0	Q228F Q228H Q228I Q228K Q228L Q228M Q228R Q228W Q228Y					-2.614640566899764	-2.3085296292048785																																																	2	-0.9743900653682142
1	F229W							-2.0676497260577724	-2.2246288693854543		-2.033754643795118				-2.461258101516977	-2.339897410381554	-2.285284546866445																																							6	-1.0589247568576174
2	K230F K230W K230Y														-2.2045868973490315																																									1	-0.6022934486745157
3	D236E D236F D236H D236I D236K D236L D236M D236Q D236R D236V D236W D236Y																							-2.084918088110641														2.264072249293417																		2	0.7263847203942587
4	K240F K240W K240Y																								-2.307840703895901												2.0444425047738872	3.0308234486871704																		3	1.4418563123912893
5	R241F R241W R241Y																								-2.3283765614027505													2.5405287483977497																		2	0.7373840623316664
6	K242F K242W K242Y	-2.2903667836738832																																				2.3561660733033736																		2	0.6885997632098301
7	E243F E243H E243I E243K E243L E243M E243Q E243R E243W E243Y																																					2.647885372684405																		1	1.8239426863422026
8	F244W																								-2.1566216690918902																		-2.816097911185028													2	-0.9909065267589726
9	L245F L245R L245W L245Y	-2.188424398749131																																				2.295215479061706																		2	0.702263693437525
10	D246E D246F D246H D246I D246K D246L D246M D246Q D246R D246V D246W D246Y	-3.242617370388404		-2.07699505683858																-2.481925060579036																		2.5143087854784825																		4	-0.25744574046550744
11	D247E D247F D247H D247I D247K D247L D247M D247Q D247R D247V D247W D247Y	-2.445426280533915																																				2.7298375893654883																		2	0.761470436277191
12	L248F L248R L248W L248Y	-2.272743960533364																																				2.17421495734072																		2	0.633823665602452
13	F249W	-3.52537805921512	-2.154701952814102	-3.292168335977466	-2.0578495723254098	-2.6854514060590966	-2.450526983813859		-2.372470986858199	-2.0142619978975165	-2.1741231668386267	-2.033376953865082								-2.904574116912165																																				11	-1.388740294381387
14	S250C S250D S250E S250F S250H S250I S250K S250L S250M S250N S250P S250Q S250R S250T S250V S250W S250Y	-3.565676004753067		-2.656535902128547																-2.6922287208587687																		2.286018543354073																		4	-0.525684416877262
15	M252F M252K M252R M252W M252Y																																					2.121451295083374																		1	1.560725647541687
16	R255F R255W R255Y																																					2.06789402234567				-2.287854430440331														2	0.593346530635113
17	G256A G256C G256D G256E G256F G256H G256I G256K G256L G256M G256N G256P G256Q G256R G256S G256T G256V G256W G256Y																																					2.211690636431248																		1	1.605845318215624
18	T257E T257F T257H T257I T257K T257L T257M T257Q T257R T257V T257W T257Y																																					2.234998481412865																		1	1.6174992407064326
19	P258E P258F P258H P258I P258K P258L P258M P258Q P258R P258V P258W P258Y																																					2.0992158211567653																		1	1.5496079105783827
20	V259F V259H V259I V259K V259L V259M V259R V259W V259Y	-2.634542912494517		-2.8852774098080087		-2.365840586577181	-2.354685727982863		-2.216096980333462		-2.182964931325229	-2.239949264595509	-2.173197002570737																																											8	-1.2280616461875005
21	N260E N260F N260H N260I N260K N260L N260M N260Q N260R N260V N260W N260Y			-2.215484123124774										-2.4719168681450805	-2.1195582502615347	-2.249224371820125																																								4	-1.011236722670303
22	I262F I262R I262W I262Y																																					-2.107450549233305																		1	-0.5537252746166526
23	P263E P263F P263H P263I P263K P263L P263M P263Q P263R P263V P263W P263Y																																					-3.196189206323167																		1	-1.0980946031615835
24	M265F M265K M265R M265W M265Y	-2.5508513864531728																																				-2.903998587516233																		2	-1.151616657989802
25	M274F M274K M274R M274W M274Y							-2.035029610129942																																																1	-0.5175148050649709
26	T280E T280F T280H T280I T280K T280L T280M T280Q T280R T280V T280W T280Y																																										-2.292746969456168													1	-0.646373484728084
27	E281F E281H E281I E281K E281L E281M E281Q E281R E281W E281Y																																										-2.7290331402275245	-2.458941168545731												2	-1.0626581029244184
28	V286F V286H V286I V286K V286L V286M V286R V286W V286Y																																										-2.3931440500564114													1	-0.6965720250282057
29	N290E N290F N290H N290I N290K N290L N290M N290Q N290R N290V N290W N290Y																																																-2.3205828416531564							1	-0.6602914208265782
30	K291F K291W K291Y																																										-2.3599510212572463													1	-0.6799755106286232
31	K292F K292W K292Y																			2.0442887801991203																		-2.2966521753392524																		2	0.5825455349532893
32	L293F L293R L293W L293Y																																					-2.4545432470549096																		1	-0.7272716235274548
33	R295F R295W R295Y																																					-2.845545047624295																		1	-0.9227725238121476
34	L301F L301R L301W L301Y							-2.0902822802581285																																																1	-0.5451411401290642
35	T305E T305F T305H T305I T305K T305L T305M T305Q T305R T305V T305W T305Y																															-2.008772740778832																								1	-0.504386370389416
36	T308E T308F T308H T308I T308K T308L T308M T308Q T308R T308V T308W T308Y																			2.4139125694587507																																				1	1.7069562847293753
37	A311C A311D A311E A311F A311H A311I A311K A311L A311M A311N A311P A311Q A311R A311T A311V A311W A311Y																																	-2.091754699460173																						1	-0.5458773497300864
38	F312W																																																		-2.2162043565989946					1	-0.6081021782994973
39	T313E T313F T313H T313I T313K T313L T313M T313Q T313R T313V T313W T313Y																					-2.3122927418730503	-2.170661765403945						-2.3885199651295186	-2.1490653040740018	-2.31251735112514	-2.220574654071988	-2.2128476373119303	-2.851263199632968	-2.891866309594776	-2.8589964509611563															-2.0783042976561426					11	-1.2872424730695515
40	R315F R315W R315Y																																														-2.336134996068694	-2.838373142398009	-2.7629881128028377	-2.02650067094375	-2.356902069520165					5	-1.220149831955576
41	T316E T316F T316H T316I T316K T316L T316M T316Q T316R T316V T316W T316Y																										-2.142796241595474																				-2.7477619330334697	-3.53651100735986	-3.673271363457184	-3.015237609457006	-4.150055081639112	-3.5633254478801	-3.2412568452992967	-2.8347570983003814	-2.3845983699875144	10	-1.935415545273582
42	Y318W																																															-2.1520430087164044	-2.1471330936698467							2	-0.7663920341287506
43	M319F M319K M319R M319W M319Y																																												-2.0032709262481943		-2.424708342138475		-2.9311685605731417	-2.101157598872995	-2.127403689346433					5	-1.0979515195298732
44	K320F K320W K320Y																																					2.0623714754313007							-2.0443965685602667		-2.723592645893853	-3.505674204679922	-3.170945474583992	-2.2839624177219684	-2.067911909285907					7	-0.8417639681618259
45	Y321W																																															-2.350300771020265	-2.3451639572071623							2	-0.8984882427424757
46	L322F L322R L322W L322Y																																															-2.318448762918483								1	-0.6592243814592416
47	Y323W																																					2.24197795343454											-2.0992042533431365							2	0.7142579000304679
48	P324E P324F P324H P324I P324K P324L P324M P324Q P324R P324V P324W P324Y																																					2.302795738831552																		1	1.651397869415776
49	Y325W																																					2.4396672524691145																		1	1.7198336262345573
50	K329F K329W K329Y																								-2.073793902513174																															1	-0.5368969512565871
51	N334E N334F N334H N334I N334K N334L N334M N334Q N334R N334V N334W N334Y																																										-2.0367150790263397													1	-0.5183575395131699
52	P335E P335F P335H P335I P335K P335L P335M P335Q P335R P335V P335W P335Y															-2.399916938583784																											-2.447723884230339		-3.3398961389306097	-2.901938806521005										4	-1.4178951536531479
53	N336E N336F N336H N336I N336K N336L N336M N336Q N336R N336V N336W N336Y																									-2.1116293396194643	-2.137337795893504														-2.8389323052283224		-2.340184603276068	-2.0260523547387024	-2.7854960745050565	-2.840909555132702										7	-1.2600677535492277
54	E337F E337H E337I E337K E337L E337M E337Q E337R E337W E337Y																																								-2.170805588966307				-2.099789233923966	-2.357087059160967										3	-0.90692047051281
55	L338F L338R L338W L338Y																																								-2.1934639349728062				-2.229990107830632	-2.2079188474902125										3	-0.9078432225734128
56	Q339F Q339H Q339I Q339K Q339L Q339M Q339R Q339W Q339Y	2.0023075541575697																																						-2.357735146980811																2	0.5481908023922529
57	D343E D343F D343H D343I D343K D343L D343M D343Q D343R D343V D343W D343Y	2.0835572643257336																		2.6189455831910995																																				2	2.234167615838944
58	S344C S344D S344E S344F S344H S344I S344K S344L S344M S344N S344P S344Q S344R S344T S344V S344W S344Y																			2.0038534554502974																																				1	1.5019267277251487
59	N345E N345F N345H N345I N345K N345L N345M N345Q N345R N345V N345W N345Y																			2.221219260038731																																				1	1.6106096300193655
60	R346F R346W R346Y													2.042399446161792	2.0552256645189977	2.170275677172057	2.1114623118021365	2.177831650057624	2.0767274551503565	2.731705812207132							-2.413974971923712	-2.150742166895826																			-2.487840345875583	-2.761043736876581	-3.372818023574394	-2.992489176831108	-3.762224339598486					14	0.6282996836996271
61	R347F R347W R347Y																			2.222504911554501																																				1	1.6112524557772505
62	E348F E348H E348I E348K E348L E348M E348Q E348R E348W E348Y																			2.0508563601224634								-3.075205607535076										-2.565367300123317	-2.682566263201559																	4	-0.4544565621474977
63	G349A G349C G349D G349E G349F G349H G349I G349K G349L G349M G349N G349P G349Q G349R G349S G349T G349V G349W G349Y	2.137365931122164																		2.1658899418531417	2.0628462673951224							-2.217356597418896																										-2.077145458001219		5	1.1786000141583857
64	R350F R350W R350Y	3.1446584881152053	2.211761722185927	2.004123292013688																3.308993373059936	2.360375444558156																																			5	3.0049853866554854
65	R351F R351W R351Y	3.617252227990279	2.315814605810783	2.2354037582308237	2.0093289957267424														2.019013885538232	3.672981053963652	2.461351869576245																	2.088484023575389																		8	3.157736713379127
